{
  "slug": "tokyo",
  "name": "Tokyo",
  "country": "Japan",
  "countryCode": "JP",
  "region": "Tokyo Metropolis",
  "coordinates": {
    "lat": 35.6762,
    "lon": 139.6503
  },
  "population": 14094034,
  "palette": [
    {
      "hex": "#1E8A5A",
      "name": "Metropolitan Green",
      "layer": "official",
      "rationale": "The Tokyo metropolitan symbol is commonly presented in a vivid green associated with growth.",
      "confidence": 0.78,
      "official": true,
      "prominence": 0.62
    },
    {
      "hex": "#2B2F3A",
      "name": "Night Glass",
      "layer": "architectural",
      "rationale": "Dark glass and steel high-rises shape a useful neutral for Tokyo's evening skyline.",
      "confidence": 0.66,
      "official": false,
      "prominence": 0.56
    },
    {
      "hex": "#E84A5F",
      "name": "Signal Red",
      "layer": "editorial",
      "rationale": "A bright urban accent captures crossings, signage, and high-density visual rhythm without official status.",
      "confidence": 0.52,
      "official": false,
      "prominence": 0.4
    },
    {
      "hex": "#F7D6E0",
      "name": "Sakura Mist",
      "layer": "natural",
      "rationale": "Soft blossom pink adds a seasonal layer that is culturally legible but not year-round dominant.",
      "confidence": 0.62,
      "official": false,
      "prominence": 0.36
    },
    {
      "hex": "#536DFE",
      "name": "Transit Blue",
      "layer": "editorial",
      "rationale": "Cool electric blue supports Tokyo's rail-and-wayfinding identity as an editorial mobility cue.",
      "confidence": 0.5,
      "official": false,
      "prominence": 0.34
    },
    {
      "hex": "#C8B273",
      "name": "Temple Gold",
      "layer": "cultural",
      "rationale": "Muted gold references shrine and temple details within the larger contemporary city fabric.",
      "confidence": 0.55,
      "official": false,
      "prominence": 0.3
    },
    {
      "hex": "#D9D5CC",
      "name": "Concrete Pearl",
      "layer": "architectural",
      "rationale": "A light concrete neutral balances the palette for stations, streetscapes, and dense mixed-use blocks.",
      "confidence": 0.6,
      "official": false,
      "prominence": 0.48
    }
  ],
  "sources": [
    {
      "title": "Tokyo Metropolitan Government",
      "url": "https://www.metro.tokyo.lg.jp/",
      "publisher": "Tokyo Metropolitan Government",
      "sourceType": "government",
      "note": "Used for official metropolitan identity context."
    },
    {
      "title": "Corporate Identity",
      "url": "https://www.tokyometro.jp/lang_en/corporate/profile/ci/index.html",
      "publisher": "Tokyo Metro Co., Ltd.",
      "sourceType": "other",
      "note": "Used as transport-brand context for mobility-layer interpretation."
    }
  ],
  "notes": "Complete seed record with one official metropolitan identity color and editorial urban, seasonal, cultural, and mobility layers.",
  "editorialSummary": "Tokyo's complete starter palette pairs official metropolitan green with night glass, signal color, sakura softness, transit blue, temple gold, and concrete neutrals."
}
