{
  "slug": "lisbon",
  "name": "Lisbon",
  "country": "Portugal",
  "countryCode": "PT",
  "region": "Lisbon District",
  "coordinates": {
    "lat": 38.7223,
    "lon": -9.1393
  },
  "population": 545923,
  "palette": [
    {
      "hex": "#F2D398",
      "name": "Limestone Cream",
      "layer": "architectural",
      "rationale": "Warm limestone facades and sunlit paved squares are common in central neighborhoods.",
      "confidence": 0.85,
      "official": false,
      "prominence": 0.8
    },
    {
      "hex": "#2D5A8C",
      "name": "Azulejo Blue",
      "layer": "cultural",
      "rationale": "Blue-and-white azulejo tile traditions strongly influence Lisbon's visual identity.",
      "confidence": 0.9,
      "official": false,
      "prominence": 0.75
    },
    {
      "hex": "#D94E41",
      "name": "Tram Red",
      "layer": "editorial",
      "rationale": "A high-contrast accent used editorially to represent transport energy and movement.",
      "confidence": 0.65,
      "official": false,
      "prominence": 0.45
    },
    {
      "hex": "#F6E7D0",
      "name": "Calcada Light",
      "layer": "architectural",
      "rationale": "A pale editorial neutral references calçada paving, sun glare, and the bright pedestrian surfaces of central Lisbon.",
      "confidence": 0.7,
      "official": false,
      "prominence": 0.52
    }
  ],
  "sources": [
    {
      "title": "Lisboa em Números",
      "url": "https://www.lisboa.pt/",
      "publisher": "Câmara Municipal de Lisboa",
      "sourceType": "government",
      "note": "Used for city background and demographic context."
    },
    {
      "title": "Azulejos in Lisbon",
      "url": "https://www.visitlisboa.com/en/p/azulejos",
      "publisher": "Visit Lisboa",
      "sourceType": "media",
      "note": "Used to support interpretation of tile-driven color identity."
    }
  ],
  "notes": "Seed record for data model validation; all colors are source-informed or editorial interpretations, with no official city color claim.",
  "editorialSummary": "Lisbon's palette combines stone warmth, azulejo blue, calçada brightness, and a selective transport accent to balance material culture with editorial interpretation."
}
